Q.1 Create a table Result which stores the records of 5 students where the fields as 
    rollno, name, percentage
  Ans:
   create table Result(rollno number , name varchar2(15), percentage number);
   insert into Result values(1,'Soham',67);
   insert into Result values(2,'Ajay',45);
   insert into Result values(3,'Jay',65);
   insert into Result values(4,'Digvijay',75)
   insert into Result values(5,'Digvijay',19);
   select * from Result;
    ROLLNO NAME            PERCENTAGE
---------- --------------- ----------
         1 Soham                   67
         2 Ajay                    45
         3 Jay                     65
         4 Digvijay                75
         5 Digvijay                19
-------------------------------------------------------------------------------------------------------------------------------------------------------------------------
Q.2 Add a column in the Result table named as Grade.
 Ans:
    alter table Result add Grade varchar2(2);
    Table altered. 
    select * from Result;
    ROLLNO NAME            PERCENTAGE GR
---------- --------------- ---------- --
         1 Soham                   67
         2 Ajay                    45
         3 Jay                     65
         4 Digvijay                75
         5 Digvijay                19
------------------------------------------------------------------------------------------------------------------------------------------------------------------------
Q.3 Create a table marks which stores the marks of 5 subjects(physics,chemistry,maths,computer,english) and display the percentage. Store record of 5 students.
 Ans: 
 create table Student_marks(physics number,chemistry number,maths number,computer number,english number,percentage as (((physics+chemistry+maths+computer+english)*100)/500));
 Table created.
 insert into Student_marks(physics,chemistry,maths,computer,english) values(50,45,65,75,80);
 1 row created.
 select * from Student_marks;
   PHYSICS  CHEMISTRY      MATHS   COMPUTER    ENGLISH PERCENTAGE
---------- ---------- ---------- ---------- ---------- ----------
        50         45         65         75         80         63
 insert into Student_marks(physics,chemistry,maths,computer,english) values(50,50,50,50,50);
 1 row created.
 insert into Student_marks(physics,chemistry,maths,computer,english) values(35,35,35,35,35);
 1 row created.
 insert into Student_marks(physics,chemistry,maths,computer,english) values(67,80,90,90,90);
 1 row created.
 insert into Student_marks(physics,chemistry,maths,computer,english) values(89,90,90,90,90);
 1 row created.
 select * from Student_marks;
   PHYSICS  CHEMISTRY      MATHS   COMPUTER    ENGLISH PERCENTAGE
---------- ---------- ---------- ---------- ---------- ----------
        50         45         65         75         80         63
        50         50         50         50         50         50
        35         35         35         35         35         35
        67         80         90         90         90       83.4
        89         90         90         90         90       89.8
------------------------------------------------------------------------------------------------------------------------------------------------------------------------
Q.4 Rename the table Result with StudentScore.
 Ans:
 alter table Result rename to Student_score;
 Table altered.
 ---------------------------------------------------------------------------------------------------------------------------------------------------------------------------
 Q.5 Create two tables A and B where A has 3 columns and B has 2 columns , Copy last two columns from table A to Table B.
  Ans:
  create table A(id number , name varchar2(15), contact number);
  create table B( emp_name varchar2(15), emp_contact number);

insert into A values(01,'Soham',1234567891);
1 row created.
insert into A values(02,'Raju',1234567892);
1 row created.
insert into A values(03,'Ajay',1234567893);
1 row created.
insert into A values(04,'Vijay',1234567894);
1 row created.
insert into A values(05,'Jay',1234567895);
1 row created.
insert into B(emp_name,emp_contact) select name,contact from A;
5 rows created.
select * from B;
EMP_NAME        EMP_CONTACT
--------------- -----------
Soham            1234567891
Raju             1234567892
Ajay             1234567893
Vijay            1234567894
Jay              1234567895
-----------------------------------------------------------------------------------------------------------------------------------------------------------------------
Q.6 Create a table which stores the information about a product . Fields are pid,pname,pqty,pcost. 
     a) Display records in ascending order of quantity.  
     b) Display records in descending order of product cost.
     c) Display record for the product where the cost is highest.
     d) Display the pid and pname of those products where the pcost is same.
  Ans:
create table Product(pid number, pname varchar2(20),paty number,pcost number);
Table created.
insert into Product values(101,'Laptop',15,15000);
1 row created.
insert into Product values(104,'Keyborad',25,1000);
1 row created.
insert into Product values(102,'ROM',05,21000);
1 row created.
insert into Product values(106,'Walkman',10,1100);
1 row created.
insert into Product values(103,'Ipod',10,1100);
1 row created.
insert into Product values(105,'Iphone',06,110000);
1 row created.
select * from Product;
       PID PNAME                      PATY      PCOST
---------- -------------------- ---------- ----------
       101 Laptop                       15      15000
       104 Keyborad                     25       1000
       102 ROM                           5      21000
       106 Walkman                      10       1100
       103 Ipod                         10       1100
       105 Iphone                        6     110000

6 rows selected.
select * from product ORDER BY paty;
       PID PNAME                      PATY      PCOST
---------- -------------------- ---------- ----------
       102 ROM                           5      21000
       105 Iphone                        6     110000
       106 Walkman                      10       1100
       103 Ipod                         10       1100
       101 Laptop                       15      15000
       104 Keyborad                     25       1000
6 rows selected.
select * from product ORDER BY paty desc;
       PID PNAME                      PATY      PCOST
---------- -------------------- ---------- ----------
       104 Keyborad                     25       1000
       101 Laptop                       15      15000
       106 Walkman                      10       1100
       103 Ipod                         10       1100
       105 Iphone                        6     110000
       102 ROM                           5      21000
6 rows selected.
select pid,pname from product where pcost = 1100
       PID PNAME
---------- --------------------
       106 Walkman
       103 Ipod
------------------------------------------------------------------------------------------------------------------------------------------------------------------------
Q.7 Create a table where insert 5 records like name,dob and city of a customer using single insert query.
 Ans:
 create table info(name varchar2(15),dob date,city varchar2(10));

insert all
into info(name,dob,city) values('Soham',date '2014-10-09','Pune')
into info(name,dob,city) values('Ajay',date '2002-02-21','Satara')
into info(name,dob,city) values('Rishikish',date '1999-05-27','Mumbai')
into info(name,dob,city) values('Digvijay',date '1999-10-01','Pune')
into info(name,dob,city) values('jay',date '2001-11-28','Satara')

select * from dual;

select * from info;
--------------------------------------------------------------------------------------------------------------------------------------------------------------------------
Q.8 Create a table which stores the salary of 3 employees along with the name and display the names salary wise (highest first).
 Ans:
 create table employee(ename varchar2(15),salary number(5));

insert all
into employee(ename,salary) values('Ajay',20000)
into employee(ename,salary) values('Jay',35000)
into employee(ename,salary) values('Vijay',25000)

select *from dual;

select * from employee;

select * from employee ORDER BY salary DESC;
---------------------------------------------------------------------------------------------------------------------------------------------------------------------------
Q.9 Update the highest salary of the employee in above question to the minimum of all.
 Ans:
 update employee set salary = 20000 where salary > 30000;

select * from employee ORDER BY salary DESC;
---------------------------------------------------------------------------------------------------------------------------------------------------------------------------
Q.10 create a table employee: eid, age, dept, salary. Show name of dept with lowest salary using group by.
 Ans:
 create table employee_1(eid number, age number, dept varchar2(20), salary number);
 
insert all
into employee_1(eid, age, dept, salary) values(1001,25,'Production',20000)
into employee_1(eid, age, dept, salary) values(1045,32,'Purchasing',35000)
into employee_1(eid, age, dept, salary) values(1020,26,'Marketing',25000)
into employee_1(eid, age, dept, salary) values(1006,23,'Production',22000)
into employee_1(eid, age, dept, salary) values(1049,30,'Purchasing',32000)
into employee_1(eid, age, dept, salary) values(1024,21,'Marketing',15000)

select *from dual;

select * from employee_1;

select dept, min(salary) as "min_salary" from  employee_1 group by dept having min(salary)<35000;
--------------------------------------------------------------------------------------------------------------------------------------------------------------------------
Q.11 Write a query to perform following operations on the table :
      a) Create a table as Population :  State, popoulation
      b) Find minimum population
      c) Find maximum population
      d) find average population
      e) Display name of state population wise in descending order
      f) Display name of state population wise in ascending order
 Ans:
CREATE table Population(State varchar2(20), Population number);

insert all
into Population(State,Population) values('Uttar Pradesh',237882725)
into Population(State,Population) values('Maharashtra',123144223)
into Population(State,Population) values('Lakshadweep',73183)
into Population(State,Population) values('Goa',1586250)
into Population(State,Population) values('West Bengal',99609303)

select * from dual;

select min(Population) AS Min_Population from Population;

select max(Population) AS Min_Population from Population;

select Avg(Population) AS Min_Population from Population;

select * from Population ORDER BY Population desc;

select * from Population ORDER BY Population ;
--------------------------------------------------------------------------------------------------------------------------------------------------------------------------
Q.12 Create a table ItemSales : Itemname, Sales, city  
     Display the following output (Create a query which displays the Total sales citywise)
      Item           Sales
      ----           -----
      RAM             4
      Hard Disk       3
      Mouse           1
 Ans:
Create table ItemSales(Itemname varchar2(20), Sales number, city varchar2(20));

insert all
into ItemSales(Itemname, Sales, city) values('RAM',4,'Pune')
into ItemSales(Itemname, Sales, city) values(' Hard Disk',3,'Pune')
into ItemSales(Itemname, Sales, city) values('Mouse',1,'Bombay')
into ItemSales(Itemname, Sales, city) values('ROM',6,'Satara')
into ItemSales(Itemname, Sales, city) values('Head phone',4,'Pune')

select * from dual;

select *from ItemSales;

select city, sum(Sales) as "Total_Sale" from  ItemSales group by city ;
------------------------------------------------------------------------------------------------------------------------------------------------------------------------------
Q.13 Make a table which stores the email id and password where password should not be saved if the length is less than 8 character.
 Ans:
Create table e_mail(email_id  varchar2(15), pass varchar2(12)  check (length(pass)>=8));

INSERT INTO e_mail VALUES('Nilesh',123456789);
INSERT INTO e_mail VALUES('Nilesh',12);
select *from e_mail; 
------------------------------------------------------------------------------------------------------------------------------------------------------------------------------
Q.14 Make a table which stores the name and mobile no of customers. where mobile no can not saved in database if the mobile no is less than 10 digits.
 Ans:
Create table gen_infor(name varchar2(20),mobile_no varchar2(11) check(length(mobile_no)>=10));

INSERT INTO gen_infor VALUES('Nilesh',1234567890);
INSERT INTO gen_infor VALUES('Pillay',1);

select *from gen_infor;
-----------------------------------------------------------------------------------------------------------------------------------------------------------------------------
Q.15 Create a table person which stores the ID,name,email where define ID as primary key.Create another table Birthday which stores date of birth and ID.
     Join both tables and create Foreign key in Birthday.
    Ans:
      create table Empl(emp_id number,name varchar2(20),e_mail varchar2(20),primary key(emp_id));
     create table Birthday(DOB date ,id number CONSTRAINT fk_eid REFERENCES Empl(emp_id));
   
    insert into Empl values(101,'Amit','amit12@gmail.com');
    insert into Empl values(102,'Suresh','suresh10@gmail.com');
    insert into Empl values(103,'Sunny','sunny34@gmail.com');
    insert into Empl values(104,'Bunny','bunny09@gmail.com');
    insert into Empl values(105,'Happy','Happy007@gmail.com');
    
    select * from Empl;
    
    insert into  Birthday values(date '1975-03-23',101);
    insert into Birthday values(date '1982-06-21',102);
    insert into Birthday values(date '1983-01-12',103);
    insert into Birthday values(date '1989-12-30',104);
     insert into Birthday values(date '1989-01-10',105);
    
    select * from  Birthday;
    
    select e.emp_id,e.name,e.e_mail,a.dob from Empl e, Birthday a where e.emp_id=a.id;
----------------------------------------------------------------------------------------------------------------------------------------------------------------------------
Q.16 Create a table where records of an employee is maintained . 
     Fields are EID (primary key), Ename (NOT NULL), officeno (Unique), DateOfJoining(NOT NULL),CompanyName(Default),Salary(Check is : salary > 0)
     Create PersonnelDetails : ID( Foreign Key ) , Addres (NOT NULL), contactno(NOT NULL , UNIQUE) 
     Join Both tables and Display output
  Ans:
   create table Employee_Digit(eid number,ename varchar2(20) NOT NULL ,office_no number Unique,Date_Of_Joining date NOT NULL,CompanyName varchar2(10) Default 'Digit',salary number Check ( salary > 0),primary key(eid));
    create table Personnel_Details(Address varchar2(25) NOT NULL ,contact_no number NOT NULL ,id number CONSTRAINT pk_eid REFERENCES Employee_Digit(eid));
   
    insert into Employee_Digit values(101,'Amit',020454678,date '2002-05-12','Digit',21000);
    insert into Employee_Digit values(102,'Atif',020454674,date '2002-06-19','Digit',20000);
    insert into Employee_Digit(eid ,ename ,office_no ,Date_Of_Joining ,CompanyName ,salary )values(103,'Mahadev',020454100,date '2002-10-25',25000);
    insert into Employee_Digit values(104,'Ravaan',020454623,date '2002-01-06','Digit',30000);
    insert into Employee_Digit values(105,'Rishi',020453478,date '1999-05-27','Digit',40000);
    
    select * from Employee_Digit;
    
    insert into  Personnel_Details values('Pune-411006',9944556677,101);
    insert into  Personnel_Details values('Pune-411011',9944557788,102);
    insert into  Personnel_Details values('Pune-411032',9944552266,103);
    insert into  Personnel_Details values('Pune-411001',9944667788 ,104);
    insert into  Personnel_Details values('Pune-411012',9944558899 ,105);
    
    select * from  Personnel_Details;
    
    select e.eid,e.ename,e.office_no ,e.Date_Of_Joining ,e.CompanyName ,e.salary ,a.Address,a.contact_no from Employee_Digit e, Personnel_Details a where e.eid=a.id;
-----------------------------------------------------------------------------------------------------------------------------------------------------------------------------
Q.17  Create a table Students ---- Rollno( Primary Key ), 
                                   Name (NOT NULL)
  
      Create a table College ----- CollegeId ( Primary Key ),
                                   EnrollId (Foreign Key ), 
                                   College Name,
                                   AdmissionDate,
                                   ContactNo

  a) Join these tables and show the output as
                                            RollNo  , Name , College Name , Admission Date , Contact No 
  b) Remove Primary Key constraint from college
  c) Input the details of 5 students for a differnt college
  d)  Group all the students based on collegeName
 Ans:
     Create table  Students (S_rollno number Primary Key , S_name varchar2(20) NOT NULL);
     Create  table College(College_Id number Primary Key ,Enroll_Id number CONSTRAINT fk_St REFERENCES Students(S_rollno) ,College_Name varchar2(20),Admission Date,Contact_No number); 
     
     INSERT INTO Students  VALUES (101,'Ajay');
     INSERT INTO Students  VALUES (102,'Jay');
     INSERT INTO Students  VALUES (103,'sanjay');
     INSERT INTO Students  VALUES (104,'Vijay');
     INSERT INTO Students  VALUES (105,'Digvijay');
     
     select * from Students;
     
    INSERT INTO College VALUES (201,101,'Abc Jr. college',date '2010-05-23',9933445446);
    INSERT INTO College VALUES (202,102,'Abc Jr. college',date'2010-05-12',9933445225); 
    INSERT INTO College VALUES (203,103,'Abc Jr. college',date'2010-06-05',9933445490); 
    INSERT INTO College VALUES (204,104,'Abc Jr. college',date '2010-05-21',9933445748); 
    INSERT INTO College VALUES (205,105,'Abc Jr. college',date '2010-07-29',9933455446); 
    
    select * from College;
    
    select Students.S_rollno,Students.S_name,College.College_Name,College.Admission,College.Contact_No from Students RIGHT JOIN College ON Students.S_rollno=College.Enroll_Id; /*a*/
    
    alter table College Drop CONSTRAINT fk_St;/*b*/
    
    INSERT INTO College VALUES (501,201,'Xyz Jr. college',date '2010-05-23',9933445446);
    INSERT INTO College VALUES (502,202,'Xyz Jr. college',date'2010-05-12',9933445225); 
    INSERT INTO College VALUES (503,203,'Xyz Jr. college',date'2010-06-05',9933445490); /*c*/
    INSERT INTO College VALUES (504,204,'Xyz Jr. college',date '2010-05-21',9933445748); 
    INSERT INTO College VALUES (505,205,'Xyz Jr. college',date '2010-07-29',9933455446); 
    
    select College_Name,count(College_Name) AS "Students_Count" from College group by College_Name; /*d*/
------------------------------------------------------------------------------------------------------------------------------------------------------------------------------
Q.18 Create a table which stores PersonName(Not Null),Mobile(Unique),Address.  Create two views v1 and v2 on the table. v1 is read only but v2 is updatable.
      v1 shows personName and Mobile while v2 shows PersonName and Address.
 Ans:
     
    create table Personal_info(P_name varchar2(20) NOT NULL ,Mobile  number Unique ,Address varchar2(20));
     
     insert into Personal_info values('Sumit',8899234565,'Delhi');
     insert into Personal_info values('Ajay',7865342199,'Mumbai');
     insert into Personal_info values('Sanjay',9933446655,'Bengaluru');
     insert into Personal_info values('Sunil',9988663322,'Pune');
     insert into Personal_info values('amit',8956979235,'Delhi');
     insert into Personal_info values('Vikas',8830605106,'Pune');
       
     select * from Personal_info;
     
     create or replace view v1 AS select P_name,Mobile from Personal_info with read only;
     select * from v1;

     create or replace view v2 AS select P_name,Address from Personal_info;
       select * from v2;
-----------------------------------------------------------------------------------------------------------------------------------------------------------------------------
Q.19 Create a PL/SQL Block which declares the radius of a circle and make a constant pi and assign values as 3.14 to it. Find the area of circle and Print area.
 Ans:
        SET SERVEROUTPUT ON
           DECLARE 
           r  real  :=4;
           pi CONSTANT real :=3.14;
           Area real;
           BEGIN
           Area :=r*r*pi;
           dbms_output.put_line('Area is the :' ||Area);
           END;
 -------------------------------------------------------------------------------------------------------------------------------------------------------------------------
Q.20 PRINT ALL ALPHABETS IN UPPERCASE IN DESCENDING ORDER
 Ans:
 declare 
str varchar2(20);
ch char(1):='Z';
c char;
i integer;
begin 
i := ASCII (ch);
     LOOP    
            IF (i = 64) then
                   exit;
            END IF;
            c := chr(i);
              DBMS_OUTPUT.PUT_LINE(c );
            i :=i-1;
       END LOOP;
END;
--------------------------------------------------------------------------------------------------------------------------------------------------------------------------
Q.21 PRINT ALL APLHABETS FROM a to z IN ASCENDING
 Ans :
 declare 
str varchar2(20);
ch char(1):='a';
c char;
i integer;
begin 
i := ASCII (ch);
     LOOP      
            IF (i = 123) then
                   exit;
            END IF;
            c := chr(i);
              DBMS_OUTPUT.PUT_LINE(c );
            i :=i+1;
       END LOOP;
END;
---------------------------------------------------------------------------------------------------------------------------------------------------------------------------
Q.22 PRINT ALL EVEN NUMBERS BETWEEN 10 AND 30 USING WHILE LOOP.USE IF CONDITION TO CHECK.
 Ans :
 DECLARE 
        v number :=10;
        i integer;
BEGIN
    WHILE v<=30 LOOP       
 if mod(v,2)=0 then 
dbms_output.put_line ( v); 
end if; 
v := v+1;
    END LOOP;
END;
---------------------------------------------------------------------------------------------------------------------------------------------------------------------------
Q.23 PRINT ALPHABETS IN REVERSE ORDER USING FOR LOOP.
 Ans:
 
----------------------------------------------------------------------------------------------------------------------------------------------------------------------
Q.24 PRINT THE FACTORIAL OF A NUMBER USING FOR LOOP.
 Ans:
 declare 
n integer := 5;
i integer :=2;
f integer :=1;
begin 
  while i<=n loop
      f :=f *i;
        i :=i+1;
   end loop;
    dbms_output.put_line(f);
    end;
----------------------------------------------------------------------------------------------------------------------------------------------------------------------
Q.25 Create an array of 5 names and print all names in Capital case.
 Ans:
 declare
       TYPE chars IS VARRAY(5) OF varchar2(10);
       nm chars; 
begin
       nm := chars('Ajay','Digvijay','Vijay','Sanjay','Soham');
       
       for i in 1..5 loop
        dbms_output.put_line((UPPERnm(i)));
       end loop;
end; 
-----------------------------------------------------------------------------------------------------------------------------------------------------------------------
Q.26 Create an array of 5 names and print all names with length in Capital case.
      "abc" ===>  ABC : 3 
 Ans:
 declare
       TYPE chars IS VARRAY(5) OF varchar2(10);
       nm chars; 
begin
       nm := chars('Ajay','Digvijay','Vijay','Sanjay','Soham');
       
       for i in 1..5 loop
        dbms_output.put_line(UPPER(nm(i)) || ':' || length(UPPER(nm(i))));

        
       end loop;
end; 
----------------------------------------------------------------------------------------------------------------------------------------------------------------------
Q.27 CONVERT A SMALL CASE LETTER TO UPPERCASE AND PRINT IT.
 Ans:
 declare 
str varchar2(20);
ch char(1):='f';
c char;
i integer;
begin 
i := ASCII (ch);
            IF (i >97) then
                i :=i-32;
            END IF;
            c := chr(i);
              DBMS_OUTPUT.PUT_LINE(c );
END;
-----------------------------------------------------------------------------------------------------------------------------------------------------------------------
Q.28 Create a procedure which accepts one parameter as a radius of circle. Declare pi as constant in the procedure and calculate area of circle & print the area in 
     other PLSQL Block.
  Ans:
create or replace procedure demo_pr(x1 in integer, x3 out real)
is 
pi CONSTANT real :=3.14;
begin
x3 := x1*x1*pi;
end;
-----
declare
n real := 4;
i real;
begin 
   demo_pr(n,i);
  DBMS_OUTPUT.PUT_LINE('Area of circle :'||i);
end;
-------------------------------------------------------------------------------------------------------------------------------------------------------------------------
Q.29 create a procedure which accepts a single parameter as a integer and it is defined as IN OUT .Procedure returns the cube of the number.
 Ans:
    create or replace procedure demo_pr1(x1 in out integer)
is 
begin
x1 := x1*x1*x1;
end;
--------------
declare
i integer;
begin 
  i:= 4;
   demo_pr1(i);
  DBMS_OUTPUT.PUT_LINE('cube of the number is '||i);
end;
-------------------------------------------------------------------------------------------------------------------------------------------------------------------------
      
